{
  "$schema": "http://json-schema.org/draft-07/schema#",
  "$id": "https://openclaw.ai/schemas/skill-enforcement-policy-v1.json",
  "title": "OpenClaw Skill Enforcement Policy",
  "description": "Schema for the post-C6-M-11 minimal enforcement policy. Only fields actually consumed by skill_integrity_monitor.sh are permitted; unconsumed config-theater fields were removed.",
  "type": "object",
  "required": [
    "version",
    "last_updated",
    "description",
    "validation"
  ],
  "additionalProperties": false,
  "properties": {
    "version": { "type": "string", "minLength": 1 },
    "last_updated": {
      "type": "string",
      "pattern": "^\\d{4}-\\d{2}-\\d{2}T\\d{2}:\\d{2}:\\d{2}Z$"
    },
    "description": { "type": "string", "minLength": 1 },
    "validation": {
      "type": "object",
      "required": ["signature"],
      "additionalProperties": false,
      "properties": {
        "signature": {
          "type": "object",
          "required": [
            "required",
            "verify_pgp",
            "trusted_keys"
          ],
          "additionalProperties": false,
          "properties": {
            "required": { "type": "boolean" },
            "verify_pgp": { "type": "boolean" },
            "trusted_keys": { "type": "array", "items": { "type": "string" } }
          }
        }
      }
    }
  }
}
