{
  "version": "1.0.0",
  "last_updated": "2026-05-30T12:00:00Z",
  "description": "Skill security enforcement policy. Only fields below are consumed by skill_integrity_monitor.sh; previously-theatrical, unconsumed fields were removed (see README.md changelog, C6-M-11).",

  "validation": {
    "signature": {
      "required": true,
      "verify_pgp": true,
      "trusted_keys": []
    }
  }
}
